### ISSUE TITLE
Client data buffer chuck TCP_NODELAY

### ISSUE THREAD

**Issue by kunalekawde** [nghttp2/nghttp2#1358]
I use nghttp2 (1.38.0) with libcurl(7.65.1), one observation while testing http/2 traffic was that client was bundling the messages together(e.g 2KB) and sending to server even when we have set tcp_nodelay for the client socket. 

Frame 19085: 1456 bytes on wire (11648 bits), 1456 bytes captured (11648 bits)
Linux cooked capture
Internet Protocol Version 4, Src: 10.165.0.202, Dst: 10.192.15.5
Transmission Control Protocol, Src Port: 40085, Dst Port: 8085, Seq: 3369, Ack: 870, Len: 1400
[2 Reassembled TCP Segments (45 bytes): #19084(41), #19085(4)]
    [Frame: 19084, payload: 0-40 (41 bytes)]
    [Frame: 19085, payload: 41-44 (4 bytes)]
    [Segment count: 2]
    [Reassembled TCP length: 45]
    [Reassembled TCP Data: 00002401040000002b83049762a1da89561da99d8ee162d2…]

Any pointers on this to check ?

**Comment by tatsuhiro-t** [comment]
libnghttp2 does not use any socket related operation.  It sounds like curl issue.

**Comment by kunalekawde** [comment]
Thanks
